{
  "chain_id": "sui:mainnet",
  "coin_type": "0xa1b2c3d4e5f60718293a4b5c6d7e8f90112233445566778899aabbccddeeff00::cred::CRED",
  "symbol": "CRED",
  "name": "Inter-galactic Credits",
  "decimals": 9,
  "icon_url": "https://assets.example.com/coins/cred.png",
  "description": "Credits — the native utility token for the example protocol.",
  "project_url": "https://cred.example.com",
  "tags": ["defi", "governance"],
  "treasury_addresses": [
    {
      "address": "0x1111111111111111111111111111111111111111111111111111111111111111",
      "label": "Protocol treasury",
      "type": "treasury"
    },
    {
      "address": "0x2222222222222222222222222222222222222222222222222222222222222222",
      "label": "Team vesting",
      "type": "vesting"
    }
  ]
}
